{
  "$schema": "https://json-schema.org/draft/2020-12/schema",
  "$id": "aethermesh-contribution-record",
  "title": "AetherMesh local contribution record",
  "description": "Local-first attribution and audit record. It does not claim consensus, peer agreement, rewards, or decentralization.",
  "type": "object",
  "additionalProperties": false,
  "required": ["schema_version", "record_id", "job_id", "creator_node_id", "contributor_node_id", "created_at", "work_type", "contribution_summary", "source", "manifest_links", "validation", "lineage", "attribution"],
  "properties": {
    "schema_version": {"const": 1},
    "record_id": {"$ref": "#/$defs/identifier"},
    "job_id": {"$ref": "#/$defs/identifier"},
    "creator_node_id": {"$ref": "#/$defs/identifier"},
    "contributor_node_id": {"$ref": "#/$defs/identifier"},
    "created_at": {"type": "string", "format": "date-time", "pattern": "^[0-9]{4}-[0-9]{2}-[0-9]{2}T[0-9]{2}:[0-9]{2}:[0-9]{2}Z$"},
    "work_type": {"type": "string", "minLength": 1},
    "contribution_summary": {"type": "string", "minLength": 1},
    "source": {
      "type": "object", "additionalProperties": false,
      "required": ["local_source_path", "artifact_ref"],
      "properties": {"local_source_path": {"$ref": "#/$defs/localRefOrNull"}, "artifact_ref": {"$ref": "#/$defs/localRefOrNull"}},
      "anyOf": [{"properties": {"local_source_path": {"type": "string"}}}, {"properties": {"artifact_ref": {"type": "string"}}}]
    },
    "manifest_links": {
      "type": "object", "additionalProperties": false,
      "required": ["node_manifest_ref", "work_manifest_ref", "input_manifest_ref", "output_manifest_ref", "validation_manifest_ref"],
      "properties": {"node_manifest_ref": {"$ref": "#/$defs/localRefOrNull"}, "work_manifest_ref": {"$ref": "#/$defs/localRefOrNull"}, "input_manifest_ref": {"$ref": "#/$defs/localRefOrNull"}, "output_manifest_ref": {"$ref": "#/$defs/localRefOrNull"}, "validation_manifest_ref": {"$ref": "#/$defs/localRefOrNull"}}
    },
    "validation": {
      "type": "object", "additionalProperties": false,
      "required": ["status", "validator_node_id", "validation_receipt_ref", "validated_at", "failure_reason"],
      "properties": {"status": {"enum": ["unvalidated", "passed", "failed"]}, "validator_node_id": {"anyOf": [{"$ref": "#/$defs/identifier"}, {"type": "null"}]}, "validation_receipt_ref": {"$ref": "#/$defs/localRefOrNull"}, "validated_at": {"anyOf": [{"type": "string", "format": "date-time", "pattern": "^[0-9]{4}-[0-9]{2}-[0-9]{2}T[0-9]{2}:[0-9]{2}:[0-9]{2}Z$"}, {"type": "null"}]}, "failure_reason": {"anyOf": [{"type": "string", "minLength": 1}, {"type": "null"}]}},
      "allOf": [{"if": {"properties": {"status": {"const": "failed"}}}, "then": {"properties": {"failure_reason": {"type": "string", "minLength": 1}}}}, {"if": {"properties": {"status": {"enum": ["unvalidated", "passed"]}}}, "then": {"properties": {"failure_reason": {"type": "null"}}}}]
    },
    "lineage": {
      "type": "object", "additionalProperties": false,
      "required": ["parent_contribution_ids", "contributor_node_id", "derived_artifact_ids", "input_hashes", "output_hashes", "deterministic_reproduction_notes"],
      "properties": {"parent_contribution_ids": {"$ref": "#/$defs/identifierList"}, "contributor_node_id": {"$ref": "#/$defs/identifier"}, "derived_artifact_ids": {"$ref": "#/$defs/identifierList"}, "input_hashes": {"$ref": "#/$defs/hashList"}, "output_hashes": {"$ref": "#/$defs/hashList"}, "deterministic_reproduction_notes": {"anyOf": [{"type": "string", "minLength": 1}, {"type": "null"}]}}
    },
    "attribution": {
      "type": "object", "additionalProperties": false,
      "required": ["author_id", "author_kind", "role", "declared_tool_or_runtime", "creation_mode"],
      "properties": {"author_id": {"$ref": "#/$defs/identifier"}, "author_kind": {"enum": ["human", "node"]}, "role": {"type": "string", "minLength": 1}, "declared_tool_or_runtime": {"anyOf": [{"type": "string", "minLength": 1}, {"type": "null"}]}, "creation_mode": {"enum": ["manual", "automatic"]}}
    }
  },
  "$defs": {
    "identifier": {"type": "string", "pattern": "^[a-z0-9][a-z0-9_.-]{2,127}$"},
    "identifierList": {"type": "array", "items": {"$ref": "#/$defs/identifier"}},
    "hashList": {"type": "array", "items": {"type": "string", "pattern": "^sha256:[0-9a-f]{64}$"}},
    "localRefOrNull": {"anyOf": [{"type": "string", "pattern": "^(?!/)(?!~)(?![A-Za-z][A-Za-z0-9+.-]*:)(?!.*\\\\)(?!.*(?:^|/)\\.\\.(?:/|$)).+$"}, {"type": "null"}]}
  },
  "x-aethermesh-schema-version": "1.0.0"
}
